name,district,price,bedroom,wc,acreage,link,date
"Bán nhà đường Lê Tấn Bê, Bình Tân","Quận Bình Tân, TPHCM",4 tỷ 450 triệu,4 PN,4 WC,50 m2,https://mogi.vn/quan-binh-tan/mua-nha-mat-tien-pho/ban-nha-duong-le-tan-be-binh-tan-id22501429,2024-04-26
Bán gấp nhà Cách mạng tháng tám.HXH.,"Quận 3, TPHCM",5 tỷ,5 PN,6 WC,95 m2,https://mogi.vn/quan-3/mua-nha-hem-ngo/ban-gap-nha-cach-mang-thang-tam-hxh-id22315438,2024-04-26
"HOT BÁN siêu phẩm nhà phố có hầm MT đường số 30 víp khu TÊN LỬA, 5X20M","Quận Bình Tân, TPHCM",15 tỷ 500 triệu,8 PN,8 WC,160 m2,https://mogi.vn/quan-binh-tan/mua-nha-mat-tien-pho/hot-ban-sieu-pham-nha-pho-co-ham-mt-duong-so-30-vip-khu-ten-lua-5x20m-id22539608,2024-04-26
"Bán nhà HXH đường Tỉnh Lộ 10 , Bình Tân","Quận Bình Tân, TPHCM",3 tỷ 200 triệu,8 PN,9 WC,100 m2,https://mogi.vn/quan-binh-tan/mua-nha-mat-tien-pho/ban-nha-hxh-duong-tinh-lo-10-binh-tan-id22501785,2024-04-26
Bán gấp nhà Cách Mạng Tháng Tám. Hxh.,"Quận 3, TPHCM",5 tỷ,4 PN,5 WC,99 m2,https://mogi.vn/quan-3/mua-nha-hem-ngo/ban-gap-nha-cach-mang-thang-tam-hxh-id22322392,2024-04-26
"Nhà mới keng MT đường số khu Tên Lửa, DT:5x20m. Kết cấu:3,5 tấm.","Quận Bình Tân, TPHCM",13 tỷ 200 triệu,2 PN,1 WC,64 m2,https://mogi.vn/quan-binh-tan/mua-duong-noi-bo/nha-moi-keng-mt-duong-so-khu-ten-lua-dt-5x20m-ket-cau-3-5-tam-id22308084,2024-04-26
Bán nhà Hẻm xe hơi đường Lê Văn Quới,"Quận Bình Tân, TPHCM",4 tỷ 200 triệu,3 PN,3 WC,30 m2,https://mogi.vn/quan-binh-tan/mua-nha-mat-tien-pho/ban-nha-hem-xe-hoi-duong-le-van-quoi-id22501758,2024-04-26
Bán gấp nhà Nguyễn Lâm.Cách 1 Căn ra đường lớn.,"Quận Phú Nhuận, TPHCM",6 tỷ 400 triệu,4 PN,5 WC,100 m2,https://mogi.vn/quan-phu-nhuan/mua-nha-hem-ngo/ban-gap-nha-nguyen-lam-cach-1-can-ra-duong-lon-id22337115,2024-04-26
"Nhà mới MT Đoàn phú Tứ gần chợ, bến xe miền Tây, 4x17m, giá 6.8 tỷ","Quận Bình Tân, TPHCM",6 tỷ 800 triệu,3 PN,3 WC,31 m2,https://mogi.vn/quan-binh-tan/mua-nha-mat-tien-pho/nha-moi-mt-doan-phu-tu-gan-cho-ben-xe-mien-tay-4x17m-gia-6-8-ty-id22475587,2024-04-26
"Bán nhà đường Hậu Giang, Quận 6","Quận 6, TPHCM",6 tỷ 800 triệu,8 PN,8 WC,70 m2,https://mogi.vn/quan-6/mua-nha-mat-tien-pho/ban-nha-duong-hau-giang-quan-6-id22503093,2024-04-26
Bán nhà mặt tiền đường Nguyễn Văn Luông,"Quận 6, TPHCM",17 tỷ,2 PN,3 WC,69 m2,https://mogi.vn/quan-6/mua-nha-mat-tien-pho/ban-nha-mat-tien-duong-nguyen-van-luong-id22503088,2024-04-26
"Bán nhà MT đường Số 19, P. Bình Trị Đông B, 10 x 19m, 3 tấm, TÊN LỬA!","Quận Bình Tân, TPHCM",29 tỷ,3 PN,3 WC,63 m2,https://mogi.vn/quan-binh-tan/mua-nha-biet-thu-lien-ke/ban-nha-mt-duo-ng-so-19-p-binh-tri-dong-b-10-x-19m-3-tam-ten-lua-id22543276,2024-04-26
"Bán nhà MT đường Số 1A, P. Bình Trị Đông B, 4 x 21m, 1 lầu, giá 9.2 tỷ","Quận Bình Tân, TPHCM",9 tỷ 200 triệu,5 PN,5 WC,52 m2,https://mogi.vn/quan-binh-tan/mua-duong-noi-bo/ban-nha-mt-duong-so-1a-p-binh-tri-dong-b-4-x-21m-1-lau-gia-9-2-ty-id22542900,2024-04-26
"Bán nhà MT đường số 4 khu Tên Lửa bình Tân, 6x22m, giá 23,9 tỷ","Quận Bình Tân, TPHCM",23 tỷ 900 triệu,4 PN,5 WC,190 m2,https://mogi.vn/quan-binh-tan/mua-nha-mat-tien-pho/ban-nha-mt-duong-so-4-khu-ten-lua-binh-tan-6x22m-gia-23-9-ty-id21983919,2024-04-26
"Bán nhà MT đường Số 1, P. Bình Trị Đông B, 6 x 20m, 3.5 tấm, giá 26 tỷ","Quận Bình Tân, TPHCM",26 tỷ,2 PN,2 WC,84 m2,https://mogi.vn/quan-binh-tan/mua-nha-mat-tien-pho/ban-nha-mt-duong-so-1-p-binh-tri-dong-b-6-x-20m-3-5-tam-gia-26-ty-id22542888,2024-04-26
"Bán nhà MT đường Số 8, P. Bình Trị Đông B, 6 x 21m, 2 tấm, giá 13.5 tỷ","Quận Bình Tân, TPHCM",13 tỷ 500 triệu,7 PN,6 WC,132 m2,https://mogi.vn/quan-binh-tan/mua-nha-mat-tien-pho/ban-nha-mt-duong-so-8-p-binh-tri-dong-b-6-x-21m-2-tam-gia-13-5-ty-id22540204,2024-04-26
"Biệt thự góc 2 MT đối diện công viên. Dt:11x20m, giá 33 tỷ Khu Tên Lửa","Quận Bình Tân, TPHCM",33 tỷ,4 PN,5 WC,126 m2,https://mogi.vn/quan-binh-tan/mua-nha-biet-thu-lien-ke/biet-thu-goc-2-mt-doi-dien-cong-vien-dt-11x20m-gia-33-ty-khu-ten-lua-id22270860,2024-04-26
"Bán nhà MT đường Tỉnh Lộ 10, P. Tân Tạo, 4.5 x 27m, cấp 4, giá 11.9 tỷ","Quận Bình Tân, TPHCM",11 tỷ 990 triệu,8 PN,8 WC,160 m2,https://mogi.vn/quan-binh-tan/mua-nha-mat-tien-pho/ban-nha-mt-duong-tinh-lo-10-p-tan-tao-4-5-x-27m-cap-4-gia-11-9-ty-id22538537,2024-04-26
"Nhà MTNB gần trường học, giáp khu Tên Lửa, Bình Tân.dt;3,6x13m!","Quận Bình Tân, TPHCM",5 tỷ 700 triệu,8 PN,9 WC,100 m2,https://mogi.vn/quan-binh-tan/mua-duong-noi-bo/nha-mtnb-gan-truong-hoc-giap-khu-ten-lua-binh-tan-dt-3-6x13m-id22537914,2024-04-26
"Bán toà nhà 2MT khu TÊN Lửa, Bình Tân.TDT;600M2,vị trí đẹp, giá 84 tỷ","Quận Bình Tân, TPHCM",84 tỷ,2 PN,2 WC,121 m2,https://mogi.vn/quan-binh-tan/mua-nha-mat-tien-pho/ban-toa-nha-2mt-khu-ten-lua-binh-tan-tdt-600m2-vi-tri-dep-gia-84-ty-id22538469,2024-04-26
"Nhà MTKD đường số 7   ,p. Tân Tạo giáp khu Tên Lửa, giá 11 tỷ.","Quận Bình Tân, TPHCM",11 tỷ,2 PN,2 WC,42 m2,https://mogi.vn/quan-binh-tan/mua-nha-mat-tien-pho/nha-mtkd-duong-so-7-p-tan-tao-giap-khu-ten-lua-gia-11-ty-id22530058,2024-04-26
"Bán nhà MT võ văn kiệt, Q. Bình Tân, 4x20m, kết cấu 4,5 tấm, giá 18 tỷ","Quận Bình Tân, TPHCM",18 tỷ,5 PN,5 WC,600 m2,https://mogi.vn/quan-binh-tan/mua-nha-mat-tien-pho/ban-nha-mt-vo-van-kiet-q-binh-tan-4x20m-ket-cau-4-5-tam-gia-18-ty-id22055226,2024-04-26
"Nhà mới MTNB khu cư xá phú lâm D gần chợ, p.10, Q.6, 4x20m, 4 tấm.Hiếu","Quận 6, TPHCM",12 tỷ 200 triệu,3 PN,4 WC,81 m2,https://mogi.vn/quan-6/mua-duong-noi-bo/nha-moi-mtnb-khu-cu-xa-phu-lam-d-gan-cho-p-10-q-6-4x20m-4-tam-hieu-id21823619,2024-04-26
"Bán Nhà Phan Văn Trị, Hẻm Xe Tải, 28M2, Kinh Doanh Đỉnh, 2.99 Tỷ","Quận Bình Thạnh, TPHCM",2 tỷ 990 triệu,4 PN,5 WC,80 m2,https://mogi.vn/quan-binh-thanh/mua-nha-hem-ngo/ban-nha-phan-van-tri-hem-xe-tai-28m2-kinh-doanh-dinh-2-99-ty-id22470142,2024-04-26
"Siêu Phẩm Hoàng Hoa Thám, Xe Hơi Ngủ Nhà, 77M2, 5.3X17M, Chỉ 8.9 Tỷ","Quận Bình Thạnh, TPHCM",8 tỷ 900 triệu,4 PN,5 WC,80 m2,https://mogi.vn/quan-binh-thanh/mua-nha-hem-ngo/sieu-pham-hoang-hoa-tham-xe-hoi-ngu-nha-77m2-5-3x17m-chi-8-9-ty-id22463525,2024-04-26
"Nhà mới mặt tiền HXH đường HL2, Bình Tân. 4x14,5m, giá 6,6 tỷ.","Quận Bình Tân, TPHCM",6 tỷ 600 triệu,1 PN,2 WC,27 m2,https://mogi.vn/quan-binh-tan/mua-nha-hem-ngo/nha-moi-mat-tien-hxh-duong-hl2-binh-tan-4x14-5m-gia-6-6-ty-id22475031,2024-04-26
"Bán Nhà Nguyễn Văn Đậu, Hẻm Xe Hơi, 40M2, 3 Tầng Mới, Chỉ 5.9 Tỷ","Quận Bình Thạnh, TPHCM",5 tỷ 900 triệu,2 PN,3 WC,77 m2,https://mogi.vn/quan-binh-thanh/mua-nha-hem-ngo/ban-nha-nguyen-van-dau-hem-xe-hoi-40m2-3-tang-moi-chi-5-9-ty-id22366430,2024-04-26
Nhà MTNB giáp Tên Lửa mới. Dt:4.2x22m. 3 tấm. Giá 10.5 tỷ,"Quận Bình Tân, TPHCM",10 tỷ 500 triệu,4 PN,5 WC,57 m2,https://mogi.vn/quan-binh-tan/mua-duong-noi-bo/nha-mtnb-giap-ten-lua-moi-dt-4-2x22m-3-tam-gia-10-5-ty-id22462021,2024-04-26
"Bán Mặt Tiền Trương Đăng Quế, 72M2, Kinh Doanh Đỉnh, 3 Tầng, 9.69 Tỷ","Quận Gò Vấp, TPHCM",9 tỷ 690 triệu,3 PN,3 WC,40 m2,https://mogi.vn/quan-go-vap/mua-nha-mat-tien-pho/ban-mat-tien-truong-dang-que-72m2-kinh-doanh-dinh-3-tang-9-69-ty-id22368257,2024-04-26
"Bán Nhà Xô Viết Nghệ Tĩnh, Hẻm Xe Hơi, 70M2, Ngang 4M, Chỉ 8.99 Tỷ","Quận Bình Thạnh, TPHCM",8 tỷ 990 triệu,4 PN,5 WC,92 m2,https://mogi.vn/quan-binh-thanh/mua-nha-hem-ngo/ban-nha-xo-viet-nghe-tinh-hem-xe-hoi-70m2-ngang-4m-chi-8-99-ty-id22374232,2024-04-26
Bán Nhà Vũ Tùng Chính Chủ  - 61.5M2 - 5X12M - Nở Hậu 5.21M -  4.15 Tỷ,"Quận Bình Thạnh, TPHCM",4 tỷ 150 triệu,4 PN,4 WC,72 m2,https://mogi.vn/quan-binh-thanh/mua-nha-hem-ngo/ban-nha-vu-tung-chinh-chu-61-5m2-5x12m-no-hau-5-21m-4-15-ty-id22236158,2024-04-26
"Nhà mới 100% đường số 1C khu Tên lửa, Bình Tân. Dt:4x16m, giá 8,5 tỷ.","Quận Bình Tân, TPHCM",8 tỷ 500 triệu,2 PN,2 WC,70 m2,https://mogi.vn/quan-binh-tan/mua-duong-noi-bo/nha-moi-100-duong-so-1c-khu-ten-lua-binh-tan-dt-4x16m-gia-8-5-ty-id22439976,2024-04-26
Khu Phân Lô - 48M2 - Hẻm Xe Tăng - 15TR/TH - PHAN VĂN TRỊ - 5.5 Tỷ,"Quận Bình Thạnh, TPHCM",5 tỷ 500 triệu,8 PN,8 WC,160 m2,https://mogi.vn/quan-binh-thanh/mua-nha-hem-ngo/khu-phan-lo-48m2-hem-xe-tang-15tr-th-phan-van-tri-5-5-ty-id22112629,2024-04-26
"Bán biệt thự khu víp, khu Tên Lửa, Bình Tân, 10x20m, kết cấu, 3.5 tấm.","Quận Bình Tân, TPHCM",29 tỷ 500 triệu,8 PN,9 WC,100 m2,https://mogi.vn/quan-binh-tan/mua-nha-biet-thu-lien-ke/ban-biet-thu-khu-vip-khu-ten-lua-binh-tan-10x20m-ket-cau-3-5-tam-id22402313,2024-04-26
Khu VIP D2 - NGUYỄN GIA TRÍ - 64M2 - Kinh Doanh Tốt - HXH - Chỉ 6.8 Tỷ,"Quận Bình Thạnh, TPHCM",6 tỷ 750 triệu,2 PN,2 WC,48 m2,https://mogi.vn/quan-binh-thanh/mua-nha-hem-ngo/khu-vip-d2-nguyen-gia-tri-64m2-kinh-doanh-tot-hxh-chi-6-8-ty-id21977634,2024-04-26
"Biệt thự víp MTNB đường số khu Tên Lửa, Bình Tân. 10x20m,","Quận Bình Tân, TPHCM",32 tỷ,5 PN,5 WC,200 m2,https://mogi.vn/quan-binh-tan/mua-nha-biet-thu-lien-ke/biet-thu-vip-mtnb-duong-so-khu-ten-lua-binh-tan-10x20m-id22383976,2024-04-26
Giáp Q1 - HXH 7M - 58M2 - Ngang 5.5M - ĐINH TIÊN HOÀNG - Chỉ 6.99 Tỷ,"Quận Bình Thạnh, TPHCM",6 tỷ 990 triệu,3 PN,3 WC,64 m2,https://mogi.vn/quan-binh-thanh/mua-nha-hem-ngo/giap-q1-hxh-7m-58m2-ngang-5-5m-dinh-tien-hoang-chi-6-99-ty-id21924218,2024-04-26
"Nhà MTNB đối diện công viên. Khu tên lửa, bình tân.6x21.5m","Quận Bình Tân, TPHCM",16 tỷ,5 PN,5 WC,200 m2,https://mogi.vn/quan-binh-tan/mua-duong-noi-bo/nha-mtnb-doi-dien-cong-vien-khu-ten-lua-binh-tan-6x21-5m-id22357074,2024-04-26
Khu Hiếm Nhà Bán NGUYỄN CỬU VÂN - 49.5M2 - Nở Hậu - Gía Ngộp Chỉ 5.7Tỷ,"Quận Bình Thạnh, TPHCM",5 tỷ 700 triệu,2 PN,2 WC,58 m2,https://mogi.vn/quan-binh-thanh/mua-nha-hem-ngo/khu-hiem-nha-ban-nguyen-cuu-van-49-5m2-no-hau-gia-ngop-chi-5-7ty-id21911992,2024-04-26
"Nhà MT đường Hoàng văn Hợp. P. An Lạc A, Tên Lửa , Bình Tân.","Quận Bình Tân, TPHCM",8 tỷ 800 triệu,4 PN,4 WC,129 m2,https://mogi.vn/quan-binh-tan/mua-duong-noi-bo/nha-mt-duong-hoang-van-hop-p-an-lac-a-ten-lua-binh-tan-id22342416,2024-04-26
"Nhà MTKD đường Trương phước phan, bình tân, 4.3x19m, giá 12. tỷ","Quận Bình Tân, TPHCM",12 tỷ,2 PN,2 WC,50 m2,https://mogi.vn/quan-binh-tan/mua-nha-mat-tien-pho/nha-mtkd-duong-truong-phuoc-phan-binh-tan-4-3x19m-gia-12-ty-id21907369,2024-04-26
"Bán nhà mới 100% MTNB khu Tên Lửa, Bình Tân 5x20m, giá 12,5 tỷ.","Quận Bình Tân, TPHCM",12 tỷ 500 triệu,4 PN,5 WC,80 m2,https://mogi.vn/quan-binh-tan/mua-duong-noi-bo/ban-nha-moi-100-mtnb-khu-ten-lua-binh-tan-5x20m-gia-12-5-ty-id22153165,2024-04-26
"Nhà C4 góc 2 MTKD, ngay chợ Da Sà, khu Tên Lửa, Bình Tân, 4,5x21m.","Quận Bình Tân, TPHCM",18 tỷ,4 PN,5 WC,81 m2,https://mogi.vn/quan-binh-tan/mua-nha-mat-tien-pho/nha-c4-goc-2-mtkd-ngay-cho-da-sa-khu-ten-lua-binh-tan-4-5x21m-id22161577,2024-04-26
"Bán nhà MTKD đường vành đai trong khu Tên Lửa, Bình Tân.","Quận Bình Tân, TPHCM",16 tỷ 500 triệu,5 PN,6 WC,100 m2,https://mogi.vn/quan-binh-tan/mua-nha-mat-tien-pho/ban-nha-mtkd-duong-vanh-dai-trong-khu-ten-lua-binh-tan-id22269404,2024-04-26
"Bán nhà MTNB nằm gần khu Tên Lửa, 5x16m, 3,5 tấm, giá 9.4 tỷ","Quận Bình Tân, TPHCM",9 tỷ 400 triệu,3 PN,2 WC,94 m2,https://mogi.vn/quan-binh-tan/mua-duong-noi-bo/ban-nha-mtnb-nam-gan-khu-ten-lua-5x16m-3-5-tam-gia-9-4-ty-id22260791,2024-04-26
"Nhà mới góc 2MT đường số khu Tên Lửa, đối diện trường học. 5x18m,","Quận Bình Tân, TPHCM",15 tỷ,4 PN,5 WC,84 m2,https://mogi.vn/quan-binh-tan/mua-nha-mat-tien-pho/nha-moi-goc-2mt-duong-so-khu-ten-lua-doi-dien-truong-hoc-5x18m-id22303255,2024-04-26
"Bán nhà góc MTNB Tạ MỸ Duật, p. An Lạc A. Gần chợ .4x20m, giá 10 tỷ","Quận Bình Tân, TPHCM",10 tỷ,5 PN,5 WC,80 m2,https://mogi.vn/quan-binh-tan/mua-duong-noi-bo/ban-nha-goc-mtnb-ta-my-duat-p-an-lac-a-gan-cho-4x20m-gia-10-ty-id22305366,2024-04-26
Bán nhà MTNB đối diện công viên lớn khu Tên Lửa.5x20m. Giá 13.850 tỷ.,"Quận Bình Tân, TPHCM",13 tỷ 850 triệu,8 PN,8 WC,160 m2,https://mogi.vn/quan-binh-tan/mua-duong-noi-bo/ban-nha-mtnb-doi-dien-cong-vien-lon-khu-ten-lua-5x20m-gia-13-850-ty-id22306533,2024-04-26
"Bán nhà MTKD Tên Lửa, Bình Tân. Dt:4,5x20m, giá 22 tỷ.","Quận Bình Tân, TPHCM",22 tỷ,8 PN,9 WC,100 m2,https://mogi.vn/quan-binh-tan/mua-nha-mat-tien-pho/ban-nha-mtkd-ten-lua-binh-tan-dt-4-5x20m-gia-22-ty-id22326794,2024-04-26
"Biệt thự MT đường số 28, khu Tên Lửa, DT:10x9m, có hầm, giá 27 tỷ.","Quận Bình Tân, TPHCM",27 tỷ,5 PN,5 WC,100 m2,https://mogi.vn/quan-binh-tan/mua-nha-biet-thu-lien-ke/biet-thu-mt-duong-so-28-khu-ten-lua-dt-10x9m-co-ham-gia-27-ty-id22344550,2024-04-26
"Nhà MTNB đường số khu vực p.10, Q.6.DT:4x10m.","Quận 6, TPHCM",7 tỷ 650 triệu,4 PN,5 WC,90 m2,https://mogi.vn/quan-6/mua-duong-noi-bo/nha-mtnb-duong-so-khu-vuc-p-10-q-6-dt-4x10m-id22380992,2024-04-26
"Biệt thự khu víp Tên Lửa, Bình Tân, 10x26.8m, kết cấu:3 tấm.","Quận Bình Tân, TPHCM",29 tỷ,6 PN,7 WC,190 m2,https://mogi.vn/quan-binh-tan/mua-nha-biet-thu-lien-ke/biet-thu-khu-vip-ten-lua-binh-tan-10x26-8m-ket-cau-3-tam-id22370704,2024-04-26
"Bán nhà MTNB đường 30 khu Tên Lửa, Bình Tân, 5x20m, giá 15. tỷ.","Quận Bình Tân, TPHCM",15 tỷ,4 PN,5 WC,40 m2,https://mogi.vn/quan-binh-tan/mua-nha-mat-tien-pho/ban-nha-mtnb-duong-30-khu-ten-lua-binh-tan-5x20m-gia-15-ty-id21991727,2024-04-26
"Biệt thự cần bán nhanh MTNB khu Tên Lửa,10x18,5m, giá 23,5 tỷ.","Quận Bình Tân, TPHCM",23 tỷ 500 triệu,4 PN,5 WC,268 m2,https://mogi.vn/quan-binh-tan/mua-nha-biet-thu-lien-ke/biet-thu-can-ban-nhanh-mtnb-khu-ten-lua-10x18-5m-gia-23-5-ty-id22081984,2024-04-26
"Cần bán nhà MT vành đai trong khu Tên Lửa.DT 6x20m, 4,5 tấm, giá 30 tỷ","Quận Bình Tân, TPHCM",30 tỷ,4 PN,5 WC,100 m2,https://mogi.vn/quan-binh-tan/mua-nha-mat-tien-pho/can-ban-nha-mt-vanh-dai-trong-khu-ten-lua-dt-6x20m-4-5-tam-gia-30-ty-id22083987,2024-04-26
"Bán nhà MTKD đường số 19 khu Tên Lửa, Bình Tân. 4,5x15m , 3,5 tấm.","Quận Bình Tân, TPHCM",18 tỷ,5 PN,6 WC,185 m2,https://mogi.vn/quan-binh-tan/mua-nha-mat-tien-pho/ban-nha-mtkd-duong-so-19-khu-ten-lua-binh-tan-4-5x15m-3-5-tam-id22177736,2024-04-26
"Nhà mới MTNB cư xá Rada,p.13,Q.6,DT:4x17m.","Quận 6, TPHCM",12 tỷ 700 triệu,5 PN,6 WC,120 m2,https://mogi.vn/quan-6/mua-duong-noi-bo/nha-moi-mtnb-cu-xa-rada-p-13-q-6-dt-4x17m-id22208391,2024-04-26
Bán biệt thự khu ao sen víp khu Tên Lửa mới.10x20m. Giá 33 tỷ.,"Quận Bình Tân, TPHCM",33 tỷ,4 PN,5 WC,68 m2,https://mogi.vn/quan-binh-tan/mua-nha-mat-tien-pho/ban-biet-thu-khu-ao-sen-vip-khu-ten-lua-moi-10x20m-gia-33-ty-id22235893,2024-04-26
"Cần bán Nhà MT phùng Tá Chu giáp Tên Lửa, Bình Tân.DT:6x13m.","Quận Bình Tân, TPHCM",9 tỷ 100 triệu,5 PN,5 WC,68 m2,https://mogi.vn/quan-binh-tan/mua-nha-mat-tien-pho/can-ban-nha-mt-phung-ta-chu-giap-ten-lua-binh-tan-dt-6x13m-id22439771,2024-04-26
"Biệt thự cần bán khu víp Tên Lửa, Bình Tân. Dt:10x20m, giá 22.5 tỷ.","Quận Bình Tân, TPHCM",22 tỷ 500 triệu,5 PN,6 WC,200 m2,https://mogi.vn/quan-binh-tan/mua-nha-biet-thu-lien-ke/biet-thu-can-ban-khu-vip-ten-lua-binh-tan-dt-10x20m-gia-22-5-ty-id22449469,2024-04-26
"Nhà MTN bộ gần công viên trường học khu Tên Lửa, 4x20m, giá 11 tỷ.","Quận Bình Tân, TPHCM",11 tỷ,4 PN,5 WC,78 m2,https://mogi.vn/quan-binh-tan/mua-duong-noi-bo/nha-mtn-bo-gan-cong-vien-truong-hoc-khu-ten-lua-4x20m-gia-11-ty-id22487189,2024-04-26
"Nhà MTNB đường số khu Tên Lửa. Dt:6x20m, giá 12.7 tỷ.","Quận Bình Tân, TPHCM",12 tỷ 700 triệu,4 PN,4 WC,200 m2,https://mogi.vn/quan-binh-tan/mua-duong-noi-bo/nha-mtnb-duong-so-khu-ten-lua-dt-6x20m-gia-12-7-ty-id22514211,2024-04-26
"Cần Bán Lô biệt thự MTNB khu Cư xá phú lâm B,p.13, Q.6. giá:12.5 tỷ.","Quận 6, TPHCM",12 tỷ 500 triệu,8 PN,8 WC,160 m2,https://mogi.vn/quan-6/mua-nha-mat-tien-pho/can-ban-lo-biet-thu-mtnb-khu-cu-xa-phu-lam-b-p-13-q-6-gia-12-5-ty-id22494072,2024-04-26
"Nhà cần bán MTNB khu Tên Lửa, Bình Tân. 5x20m, kết cấu:3,5 tấm!","Quận Bình Tân, TPHCM",11 tỷ 800 triệu,8 PN,9 WC,100 m2,https://mogi.vn/quan-binh-tan/mua-nha-mat-tien-pho/nha-can-ban-mtnb-khu-ten-lua-binh-tan-5x20m-ket-cau-3-5-tam-id22514276,2024-04-26
"Nhà MTKD đường số 7 khu Tên Lửa, Bình tân, 6x23m, giá 25.5 tỷ.","Quận Bình Tân, TPHCM",25 tỷ 500 triệu,2 PN,2 WC,185 m2,https://mogi.vn/quan-binh-tan/mua-nha-mat-tien-pho/nha-mtkd-duong-so-7-khu-ten-lua-binh-tan-6x23m-gia-25-5-ty-id22224605,2024-04-26
"Nhà MTNB gần chợ khu vực Bình phú. Quận 6. Dt:4x20m, giá 10.6 tỷ.","Quận 6, TPHCM",10 tỷ 600 triệu,4 PN,5 WC,100 m2,https://mogi.vn/quan-6/mua-nha-mat-tien-pho/nha-mtnb-gan-cho-khu-vuc-binh-phu-quan-6-dt-4x20m-gia-10-6-ty-id22519492,2024-04-26
"Biệt thự sân vườn MTNB diện tích lớn khu Tên Lửa, Bình Tân. Giá 53 tỷ.","Quận Bình Tân, TPHCM",53 tỷ,3 PN,4 WC,138 m2,https://mogi.vn/quan-binh-tan/mua-nha-biet-thu-lien-ke/biet-thu-san-vuon-mtnb-dien-tich-lon-khu-ten-lua-binh-tan-gia-53-ty-id22272817,2024-04-26
"Bán cặp nhà phố MT đường số khu Tên Lửa, Bình Tân.8x20m. Giá 17.6 tỷ","Quận Bình Tân, TPHCM",17 tỷ 600 triệu,4 PN,5 WC,80 m2,https://mogi.vn/quan-binh-tan/mua-duong-noi-bo/ban-cap-nha-pho-mt-duong-so-khu-ten-lua-binh-tan-8x20m-gia-17-6-ty-id22350712,2024-04-26
Nhà MTKD đường vành đai trong 5x20m. Có hầm. Khu Tên Lửa.,"Quận Bình Tân, TPHCM",19 tỷ 500 triệu,4 PN,5 WC,713 m2,https://mogi.vn/quan-binh-tan/mua-nha-mat-tien-pho/nha-mtkd-duong-vanh-dai-trong-5x20m-co-ham-khu-ten-lua-id22352622,2024-04-26
"Nhà MTKD đường Lý Chiêu Hoàng.p.10, Q.6. 4x23.5m, giá 15.3 tỷ.","Quận 6, TPHCM",15 tỷ 300 triệu,8 PN,8 WC,160 m2,https://mogi.vn/quan-6/mua-nha-mat-tien-pho/nha-mtkd-duong-ly-chieu-hoang-p-10-q-6-4x23-5m-gia-15-3-ty-id22368221,2024-04-26
Bán góc biệt thự có hầm đang cho thuê 45tr/tháng. Gần đường số 7.,"Quận Bình Tân, TPHCM",34 tỷ,5 PN,5 WC,100 m2,https://mogi.vn/quan-binh-tan/mua-nha-biet-thu-lien-ke/ban-goc-biet-thu-co-ham-dang-cho-thue-45tr-thang-gan-duong-so-7-id22391172,2024-04-26
"Biết thự MTNB khu Tên Lửa, Bình Tân.DT:10x25m, giá 26.5 tỷ.","Quận Bình Tân, TPHCM",26 tỷ 500 triệu,5 PN,5 WC,94 m2,https://mogi.vn/quan-binh-tan/mua-nha-biet-thu-lien-ke/biet-thu-mtnb-khu-ten-lua-binh-tan-dt-10x25m-gia-26-5-ty-id22408211,2024-04-26
"Biệt thự vip đường số 19 khu Tên Lửa, Bình Tân, có hầm thang máy.","Quận Bình Tân, TPHCM",39 tỷ,4 PN,5 WC,200 m2,https://mogi.vn/quan-binh-tan/mua-nha-biet-thu-lien-ke/biet-thu-vip-duong-so-19-khu-ten-lua-binh-tan-co-ham-thang-may-id22485131,2024-04-26
"Biệt thự DT:21x21,5m, góc 2MT khu Tên Lửa, Bình Tân.","Quận Bình Tân, TPHCM",39 tỷ,4 PN,5 WC,250 m2,https://mogi.vn/quan-binh-tan/mua-nha-biet-thu-lien-ke/biet-thu-dt-21x21-5m-goc-2mt-khu-ten-lua-binh-tan-id22480282,2024-04-26
"Biệt thự khu Tên Lửa, Bình Tân, đối diện công viên.DT:250m.","Quận Bình Tân, TPHCM",25 tỷ,5 PN,6 WC,180 m2,https://mogi.vn/quan-binh-tan/mua-nha-biet-thu-lien-ke/biet-thu-khu-ten-lua-binh-tan-doi-dien-cong-vien-dt-250m-id22491964,2024-04-26
"Nhà góc 2MT khu cư xá phú lâm D, gần chợ Hồ trọng Quý. 8,2x19m,","Quận 6, TPHCM",17 tỷ 500 triệu,5 PN,6 WC,454 m2,https://mogi.vn/quan-6/mua-duong-noi-bo/nha-goc-2mt-khu-cu-xa-phu-lam-d-gan-cho-ho-trong-quy-8-2x19m-id22500181,2024-04-26
"Bán nhà MTNB khu phố ẩm thực, p.13, Q.6. Giá 8,3 tỷ.","Quận 6, TPHCM",8 tỷ 300 triệu,3 PN,4 WC,250 m2,https://mogi.vn/quan-6/mua-duong-noi-bo/ban-nha-mtnb-khu-pho-am-thuc-p-13-q-6-gia-8-3-ty-id22500138,2024-04-26
"Bán nhà MTKD mới khu Tên Lửa, bình tân:DT:4,5x20m, giá 14 tỷ.","Quận Bình Tân, TPHCM",14 tỷ,8 PN,8 WC,160 m2,https://mogi.vn/quan-binh-tan/mua-nha-mat-tien-pho/ban-nha-mtkd-moi-khu-ten-lua-binh-tan-dt-4-5x20m-gia-14-ty-id22503710,2024-04-26
"Bán nhà MTKD đường số khu vực p.11, Q.6. Dt:9x18m, giá 46 tỷ.","Quận 6, TPHCM",46 tỷ,8 PN,9 WC,100 m2,https://mogi.vn/quan-6/mua-nha-mat-tien-pho/ban-nha-mtkd-duong-so-khu-vuc-p-11-q-6-dt-9x18m-gia-46-ty-id22505236,2024-04-26
"Biệt thự víp khu Tên Lửa, Bình Tân. Nội thất cao cấp. Dt:10x22m,","Quận Bình Tân, TPHCM",35 tỷ,4 PN,5 WC,90 m2,https://mogi.vn/quan-binh-tan/mua-nha-biet-thu-lien-ke/biet-thu-vip-khu-ten-lua-binh-tan-noi-that-cao-cap-dt-10x22m-id22507376,2024-04-26
BÁN nhà HXH đường TL10 đối diện trường học cấp 2 đang xây khu TÊN LỬA,"Quận Bình Tân, TPHCM",7 tỷ 500 triệu,5 PN,5 WC,168 m2,https://mogi.vn/quan-binh-tan/mua-nha-hem-ngo/ban-nha-hxh-duong-tl10-doi-dien-truong-hoc-cap-2-dang-xay-khu-ten-lua-id22537255,2024-04-26
"Bán cặp nhà MTNB đường số 30 khu víp Tên lửa, Bình Tân. Dt:12x20m!","Quận Bình Tân, TPHCM",28 tỷ,5 PN,6 WC,220 m2,https://mogi.vn/quan-binh-tan/mua-nha-mat-tien-pho/ban-cap-nha-mtnb-duong-so-30-khu-vip-ten-lua-binh-tan-dt-12x20m-id22521606,2024-04-26
"Bán nhà MT đường số 5 Tên Lửa, bình tân, giá 9.5 tỷ.HOT 80m2.","Quận Bình Tân, TPHCM",9 tỷ 500 triệu,2 PN,2 WC,100 m2,https://mogi.vn/quan-binh-tan/mua-duong-noi-bo/ban-nha-mt-duong-so-5-ten-lua-binh-tan-gia-9-5-ty-hot-80m2-id22513141,2024-04-26
"Nhà MTKD đường số 6 đoạn víp khu Tên Lửa.DT:4x21,5m, giá 12.5 tỷ.","Quận Bình Tân, TPHCM",12 tỷ 500 triệu,6 PN,6 WC,240 m2,https://mogi.vn/quan-binh-tan/mua-nha-mat-tien-pho/nha-mtkd-duong-so-6-doan-vip-khu-ten-lua-dt-4x21-5m-gia-12-5-ty-id22520738,2024-04-26
"Bán nhà MT đường số 5 khu Tên Lửa, vị trí đẹp, dt:4x20m, giá 11,7 tỷ.","Quận Bình Tân, TPHCM",11 tỷ 700 triệu,4 PN,5 WC,80 m2,https://mogi.vn/quan-binh-tan/mua-nha-mat-tien-pho/ban-nha-mt-duong-so-5-khu-ten-lua-vi-tri-dep-dt-4x20m-gia-11-7-ty-id22437686,2024-04-26
"Nhà Đẹp 2 Tầng 65m2, Vòng Xoay Phú Hữu, Hẻm Xe Hơi-TP Thủ Đức–Nhỉnh 5T","Quận 9 (TP. Thủ Đức), TPHCM",5 tỷ,4 PN,5 WC,86 m2,https://mogi.vn/quan-9/mua-nha-hem-ngo/nha-dep-2-tang-65m2-vong-xoay-phu-huu-hem-xe-hoi-tp-thu-ducnhinh-5t-id22541210,2024-04-26
"Bán Nhà Mặt Tiền 2 Tầng 55m2, Thạnh Mỹ Lợi, Quận 2 - Giá Nhỉnh 3T TL","Quận 2 (TP. Thủ Đức), TPHCM",3 tỷ,4 PN,5 WC,80 m2,https://mogi.vn/quan-2/mua-nha-hem-ngo/ban-nha-mat-tien-2-tang-55m2-thanh-my-loi-quan-2-gia-nhinh-3t-tl-id22540739,2024-04-26
"Siêu Phẩm 6 Tầng,Ngang To 5m, 7 Chỗ Vô Nhà, Khu Vip Phân Lô Lê Đức Thọ","Quận Gò Vấp, TPHCM",8 tỷ 600 triệu,4 PN,3 WC,65 m2,https://mogi.vn/quan-go-vap/mua-nha-biet-thu-lien-ke/sieu-pham-6-tang-ngang-to-5m-7-cho-vo-nha-khu-vip-phan-lo-le-duc-tho-id22501269,2024-04-26
"Giảm 1 Tỷ, 3 Tầng Mới Đẹp 4 x 9, 7 Chỗ Đỗ Cửa, Ngay Emart Phan Văn Trị","Quận Gò Vấp, TPHCM",8 tỷ 800 triệu,3 PN,2 WC,55 m2,https://mogi.vn/quan-go-vap/mua-nha-mat-tien-pho/giam-1-ty-3-tang-moi-dep-4-x-9-7-cho-do-cua-ngay-emart-phan-van-tri-id22544947,2024-04-26
"Siêu Phẩm Dòng Tiền - Ô Tô Đỗ Cửa - Thu Nhập 1,2 Tỷ, Xô Viết Nghệ Tĩnh","Quận Bình Thạnh, TPHCM",13 tỷ 500 triệu,6 PN,7 WC,63 m2,https://mogi.vn/quan-binh-thanh/mua-nha-hem-ngo/sieu-pham-dong-tien-o-to-do-cua-thu-nhap-1-2-ty-xo-viet-nghe-tinh-id22505282,2024-04-26
"Chỉ 4,7 Tỷ - Dtsd 78 M2, Tặng Hết Nội Thất, Huỳnh Văn Bánh - Phú Nhuận","Quận Phú Nhuận, TPHCM",4 tỷ 500 triệu,3 PN,3 WC,36 m2,https://mogi.vn/quan-phu-nhuan/mua-nha-hem-ngo/chi-4-7-ty-dtsd-78-m2-tang-het-noi-that-huynh-van-banh-phu-nhuan-id22505357,2024-04-26
"Giảm Sốc 2,1 Tỷ - 5 Tầng Ở Liền - Ôtô Đỗ Cửa - Nguyễn Đình Chiểu - Q.3","Quận 3, TPHCM",12 tỷ 400 triệu,12 PN,12 WC,80 m2,https://mogi.vn/quan-3/mua-duong-noi-bo/giam-soc-2-1-ty-5-tang-o-lien-oto-do-cua-nguyen-dinh-chieu-q-3-id22531930,2024-04-26
"Siêu Hiếm - Nhà Đẹp 5 Tầng, Ngang To 5m, 7 Chỗ Vô Nhà, Lê Văn Sỹ, Q.3.","Quận 3, TPHCM",8 tỷ 900 triệu,8 PN,9 WC,100 m2,https://mogi.vn/quan-3/mua-nha-biet-thu-lien-ke/sieu-hiem-nha-dep-5-tang-ngang-to-5m-7-cho-vo-nha-le-van-sy-q-3-id22534796,2024-04-26
"Chỉ 4,5 Tỷ - Nhà Mới Đẹp - 4 Pn - Sổ Nở Hậu - Nguyên Hồng - Bình Thạnh","Quận Bình Thạnh, TPHCM",4 tỷ 500 triệu,8 PN,8 WC,160 m2,https://mogi.vn/quan-binh-thanh/mua-nha-hem-ngo/chi-4-5-ty-nha-moi-dep-4-pn-so-no-hau-nguyen-hong-binh-thanh-id22499765,2024-04-26
Bán CHDV 24 phòng tự khai thác 200tr/tháng - Đường đẹp gần 4 trường ĐH,"Quận Bình Thạnh, TPHCM",30 tỷ,3 PN,4 WC,35 m2,https://mogi.vn/quan-binh-thanh/mua-nha-mat-tien-pho/ban-chdv-24-phong-tu-khai-thac-200tr-thang-duong-dep-gan-4-truong-dh-id22544635,2024-04-26
"Bán Biệt Thự góc 2 mặt hẻm 12m Bình Lợi (10x18m, 2 lầu) giá 17.5 tỷ TL","Quận Bình Thạnh, TPHCM",17 tỷ 500 triệu,4 PN,4 WC,36 m2,https://mogi.vn/quan-binh-thanh/mua-duong-noi-bo/ban-biet-thu-goc-2-mat-hem-12m-binh-loi-10x18m-2-lau-gia-17-5-ty-tl-id22492571,2024-04-26
