name,district,price,bedroom,wc,acreage,link,date
Thống Nhất - Hẻm 1 xẹt 30m mặt tiền - 2 tầng - 2 tỷ hơn,"Quận Gò Vấp, TPHCM",2 tỷ 850 triệu,2 PN,2 WC,19 m2,https://mogi.vn/quan-go-vap/mua-nha-hem-ngo/thong-nhat-hem-1-xet-30m-mat-tien-2-tang-2-ty-hon-id22561287,2024-05-23
Khu dân cư hiện hữu - hẻm 4m - Đoàn Văn Bơ Quận 4 - 60m2 - 6.9 tỷ TL,"Quận 4, TPHCM",6 tỷ 900 triệu,3 PN,1 WC,136 m2,https://mogi.vn/quan-4/mua-nha-hem-ngo/khu-dan-cu-hien-huu-hem-4m-doan-van-bo-quan-4-60m2-6-9-ty-tl-id22564602,2024-05-23
Nhà đẹp giá tốt trung tâm quận 7 - 4 tầng 62 - 8.9 tỷ thương lượng,"Quận 7, TPHCM",8 tỷ 900 triệu,3 PN,4 WC,65 m2,https://mogi.vn/quan-7/mua-nha-hem-ngo/nha-dep-gia-tot-trung-tam-quan-7-4-tang-62-8-9-ty-thuong-luong-id22564184,2024-05-23
"Bán mặt tiền 3 tầng D5 P25 Q Bình Thạnh, DT 5x20m, giá 20tỷ","Quận Bình Thạnh, TPHCM",20 tỷ,4 PN,4 WC,48 m2,https://mogi.vn/quan-binh-thanh/mua-nha-mat-tien-pho/ban-mat-tien-3-tang-d5-p25-q-binh-thanh-dt-5x20m-gia-20ty-id22563974,2024-05-23
"Mua Bán Nhà Riêng 3T 70M2, Dòng Tiền - Ô Tô Đỗ - Phước Long A - 5T","Quận 9 (TP. Thủ Đức), TPHCM",5 tỷ,2 PN,3 WC,70 m2,https://mogi.vn/quan-9/mua-nha-hem-ngo/mua-ban-nha-rieng-3t-70m2-dong-tien-o-to-do-phuoc-long-a-5t-id22564019,2024-05-23
"Mua Bán Nhà Riêng 170M2, Hơn 40tr/M2 Đường Xe Tải - Trung Tâm Quận 9","Quận 9 (TP. Thủ Đức), TPHCM",5 tỷ,3 PN,3 WC,122 m2,https://mogi.vn/quan-9/mua-nha-hem-ngo/mua-ban-nha-rieng-170m2-hon-40tr-m2-duong-xe-tai-trung-tam-quan-9-id22564155,2024-05-23
"Bán nhà mặt tiền Phan Văn Trị Q.Bình Thạnh, DT 8x20m, 7 tầng thang máy","Quận Bình Thạnh, TPHCM",25 tỷ,4 PN,4 WC,64 m2,https://mogi.vn/quan-binh-thanh/mua-nha-mat-tien-pho/ban-nha-mat-tien-phan-van-tri-q-binh-thanh-dt-8x20m-7-tang-thang-may-id22564343,2024-05-23
"Bán tòa nhà 8 tầng Nơ Trang Long Q.Bình Thạnh, DT 8mx25m, giá 35 tỷ","Quận Bình Thạnh, TPHCM",35 tỷ,3 PN,2 WC,133 m2,https://mogi.vn/quan-binh-thanh/mua-nha-mat-tien-pho/ban-toa-nha-8-tang-no-trang-long-q-binh-thanh-dt-8mx25m-gia-35-ty-id22564342,2024-05-23
"Bán nhà góc 2MT Nguyễn Văn Thương P.25 Q.Bình Thạnh, DT 7x20m, 17 tỷ","Quận Bình Thạnh, TPHCM",17 tỷ,4 PN,3 WC,35 m2,https://mogi.vn/quan-binh-thanh/mua-nha-mat-tien-pho/ban-nha-goc-2mt-nguyen-van-thuong-p-25-q-binh-thanh-dt-7x20m-17-ty-id22564337,2024-05-23
"Bán góc 2mt UNG VĂN KHIÊM P.25 Q Bình Thạnh, DT 10mx50m, giá 68 tỷ","Quận Bình Thạnh, TPHCM",68 tỷ,3 PN,2 WC,150 m2,https://mogi.vn/quan-binh-thanh/mua-nha-mat-tien-pho/ban-goc-2mt-ung-van-khiem-p-25-q-binh-thanh-dt-10mx50m-gia-68-ty-id22564340,2024-05-23
"Bán TÒA NHÀ CHDV 46P đường Bùi Đình Túy P24 Q.Bình Thạnh, DT 10mx40m","Quận Bình Thạnh, TPHCM",35 tỷ 700 triệu,4 PN,4 WC,60 m2,https://mogi.vn/quan-binh-thanh/mua-nha-mat-tien-pho/ban-toa-nha-chdv-46p-duong-bui-dinh-tuy-p24-q-binh-thanh-dt-10mx40m-id22564335,2024-05-23
"Bán tòa nhà mặt tiền NGUYỄN VĂN ĐẬU P11 Q Bình Thạnh, DT 7,5m x16m","Quận Bình Thạnh, TPHCM",28 tỷ,35 PN,35 WC,165 m2,https://mogi.vn/quan-binh-thanh/mua-nha-mat-tien-pho/ban-toa-nha-mat-tien-nguyen-van-dau-p11-q-binh-thanh-dt-7-5m-x16m-id22564332,2024-05-23
"Bán tòa nhà mặt tiền NGUYỄN VĂN ĐẬU P11 Q Bình Thạnh, DT 7,5m x16m","Quận Bình Thạnh, TPHCM",28 tỷ,35 PN,35 WC,165 m2,https://mogi.vn/quan-binh-thanh/mua-nha-mat-tien-pho/ban-toa-nha-mat-tien-nguyen-van-dau-p11-q-binh-thanh-dt-7-5m-x16m-id22564332,2024-05-23
"Bán tòa nhà siêu phẩm HOT HỒNG HÀ  Q.Tân Bình, DT 10mx25m, hầm 8 tầng","Quận Tân Bình, TPHCM",47 tỷ,5 PN,5 WC,161 m2,https://mogi.vn/quan-tan-binh/mua-nha-mat-tien-pho/ban-toa-nha-sieu-pham-hot-hong-ha-q-tan-binh-dt-10mx25m-ham-8-tang-id22564329,2024-05-23
"Bán mặt tiền 3 tầng D5 P25 Q Bình Thạnh, DT 5x20m, giá 20tỷ","Quận Bình Thạnh, TPHCM",20 tỷ,3 PN,2 WC,133 m2,https://mogi.vn/quan-binh-thanh/mua-nha-mat-tien-pho/ban-mat-tien-3-tang-d5-p25-q-binh-thanh-dt-5x20m-gia-20ty-id22563974,2024-05-23
"Bán nhà HXH Nguyễn Văn Đậu P.11 Q.Bình Thạnh, DT 4x20m, 4 tầng, 9.2 tỷ","Quận Bình Thạnh, TPHCM",9 tỷ 200 triệu,10 PN,10 WC,126 m2,https://mogi.vn/quan-binh-thanh/mua-nha-mat-tien-pho/ban-nha-hxh-nguyen-van-dau-p-11-q-binh-thanh-dt-4x20m-4-tang-9-2-ty-id22563971,2024-05-23
"Cần bán gấp CHDV góc 2MT đường Điện Biên Phủ, P15, Q. Bình Thạnh","Quận Bình Thạnh, TPHCM",29 tỷ,5 PN,4 WC,52 m2,https://mogi.vn/quan-binh-thanh/mua-nha-mat-tien-pho/can-ban-gap-chdv-goc-2mt-duong-dien-bien-phu-p15-q-binh-thanh-id22563972,2024-05-23
"Bán nhà HOT  mặt tiền 3/2  Q10, DT 6mx25m, 5 tầng, giá 39 tỷ","Quận 10, TPHCM",39 tỷ,6 PN,6 WC,75 m2,https://mogi.vn/quan-10/mua-nha-mat-tien-pho/ban-nha-hot-mat-tien-3-2-q10-dt-6mx25m-5-tang-gia-39-ty-id22563969,2024-05-23
"Bán nhà Gò Xoài Hẻm Xe Tải KD 100M2 ( 4x25m) chỉ 5,99 tỷ TL","Quận Bình Tân, TPHCM",5 tỷ 990 triệu,3 PN,2 WC,133 m2,https://mogi.vn/quan-binh-tan/mua-nha-hem-ngo/ban-nha-go-xoai-hem-xe-tai-kd-100m2-4x25m-chi-5-99-ty-tl-id22564529,2024-05-23
"HẺM XE HƠI TRÁNH Giáp MT HOÀNG VĂN THỤ, P4 Tân Bình- 64m2- BÁN 10.6 Tỷ","Quận Tân Bình, TPHCM",10 tỷ 600 triệu,5 PN,5 WC,96 m2,https://mogi.vn/quan-tan-binh/mua-nha-hem-ngo/hem-xe-hoi-tranh-giap-mt-hoang-van-thu-p4-tan-binh-64m2-ban-10-6-ty-id22563950,2024-05-23
BÁN NHÀ Hẻm Xe Hơi NGAY AEON TÂN PHÚ- 41 m2 - Bán 4.25 Tỷ TL,"Quận Bình Tân, TPHCM",4 tỷ 250 triệu,8 PN,5 WC,57 m2,https://mogi.vn/quan-binh-tan/mua-nha-hem-ngo/ban-nha-hem-xe-hoi-ngay-aeon-tan-phu-41-m2-ban-4-25-ty-tl-id22563976,2024-05-23
Siêu phẩm VILLA MINI GÒ VẤP Nguyễn Thái Sơn p.7 Gò Vấp 54m2 2TY470 SHR,"Quận Gò Vấp, TPHCM",2 tỷ 470 triệu,2 PN,2 WC,50 m2,https://mogi.vn/quan-go-vap/mua-nha-mat-tien-pho/sieu-pham-villa-mini-go-vap-nguyen-thai-son-p-7-go-vap-54m2-2ty470-shr-id22564518,2024-05-23
"Siêu phẩm nhà đẹp Thích Quảng Đức,P5,Phú Nhuận. 66m2/2tỷ330tr, SHR","Quận Phú Nhuận, TPHCM",2 tỷ 330 triệu,1 PN,1 WC,204 m2,https://mogi.vn/quan-phu-nhuan/mua-nha-mat-tien-pho/sieu-pham-nha-dep-thich-quang-duc-p5-phu-nhuan-66m2-2ty330tr-shr-id22564452,2024-05-23
"Siêu phẩm nhà đẹp Thích Quảng Đức,P5,Phú Nhuận. 66m2/2tỷ330tr, SHR","Quận Phú Nhuận, TPHCM",2 tỷ 330 triệu,1 PN,1 WC,204 m2,https://mogi.vn/quan-phu-nhuan/mua-nha-mat-tien-pho/sieu-pham-nha-dep-thich-quang-duc-p5-phu-nhuan-66m2-2ty330tr-shr-id22564452,2024-05-23
"Bán nhà Đặng Văn Sâm,Phú Nhuận. 65m2/2 tỷ250,SHR,đang cho thuê 18tr/th","Quận Phú Nhuận, TPHCM",2 tỷ 250 triệu,3 PN,2 WC,133 m2,https://mogi.vn/quan-phu-nhuan/mua-nha-mat-tien-pho/ban-nha-dang-van-sam-phu-nhuan-65m2-2-ty250-shr-dang-cho-thue-18tr-th-id22564489,2024-05-23
"Bán nhà mới xây Hoa Lan,P2,Phú Nhuận.68m2/2 tỷ3,SHR,đang cho thuê 17tr","Quận Phú Nhuận, TPHCM",2 tỷ 300 triệu,0 PN,0 WC,280 m2,https://mogi.vn/quan-phu-nhuan/mua-nha-mat-tien-pho/ban-nha-moi-xay-hoa-lan-p2-phu-nhuan-68m2-2-ty3-shr-dang-cho-thue-17tr-id22564512,2024-05-23
Nhà tân thới hiệp 21 quận 12 42m2 2 tầng hẻm 5m chỉ 3 tỷ 2.,"Quận 12, TPHCM",3 tỷ 200 triệu,1 PN,1 WC,330 m2,https://mogi.vn/quan-12/mua-nha-hem-ngo/nha-tan-thoi-hiep-21-quan-12-42m2-2-tang-hem-5m-chi-3-ty-2-id22561401,2024-05-23
"🌸 Nhà MT kinh doanh, nở hậu, Thảo Điền, Q.2, 5tầng, tặng nội thất.","Quận 2 (TP. Thủ Đức), TPHCM",25 tỷ,4 PN,4 WC,60 m2,https://mogi.vn/quan-2/mua-nha-mat-tien-pho/nha-mt-kinh-doanh-no-hau-thao-dien-q-2-5tang-tang-noi-that-id22564256,2024-05-23
Siêu phẩm giá học sinh tại Quang Trung P.10 Gò Vấp 68m2 2TY27 1T2L SHR,"Quận Gò Vấp, TPHCM",2 tỷ 270 triệu,4 PN,5 WC,109 m2,https://mogi.vn/quan-go-vap/mua-nha-mat-tien-pho/sieu-pham-gia-hoc-sinh-tai-quang-trung-p-10-go-vap-68m2-2ty27-1t2l-shr-id22564494,2024-05-23
"Siêu phẩm cần bán đường Au Dương Lân,P2,Q8,3 lầu,90m2,4ty450tr,SHR...","Quận 12, TPHCM",4 tỷ 450 triệu,4 PN,4 WC,90 m2,https://mogi.vn/quan-12/mua-nha-hem-ngo/sieu-pham-can-ban-duong-au-duong-lan-p2-q8-3-lau-90m2-4ty450tr-shr-id22564482,2024-05-23
"Bán nhà 3 lầu mặt tiền hẻm thông Làng Tăng Phú .Tăng Nhơn Phú A, Q9","Quận 9 (TP. Thủ Đức), TPHCM",6 tỷ 400 triệu,7 PN,7 WC,100 m2,https://mogi.vn/quan-9/mua-nha-mat-tien-pho/ban-nha-3-lau-mat-tien-hem-thong-lang-tang-phu-tang-nhon-phu-a-q9-id22564491,2024-05-23
Biệt thự dát vàng giảm từ 60 tỷ xuống còn 45 tỷ thương lượng,"Quận Gò Vấp, TPHCM",45 tỷ,3 PN,3 WC,40 m2,https://mogi.vn/quan-go-vap/mua-nha-biet-thu-lien-ke/biet-thu-dat-vang-giam-tu-60-ty-xuong-con-45-ty-thuong-luong-id22564013,2024-05-23
BIỆT thự Hoàng Hoa Thám Tân Bình 6.6m x 18m 3 tầng giảm còn 17.x tỷ,"Quận Tân Bình, TPHCM",17 tỷ 800 triệu,4 PN,4 WC,45 m2,https://mogi.vn/quan-tan-binh/mua-nha-mat-tien-pho/biet-thu-hoang-hoa-tham-tan-binh-6-6m-x-18m-3-tang-giam-con-17-x-ty-id22564015,2024-05-23
Chủ ngộp cần bán căn nhà tâm huyết gấp giá 1ty200,"Huyện Bình Chánh, TPHCM",1 tỷ 200 triệu,5 PN,5 WC,100 m2,https://mogi.vn/huyen-binh-chanh/mua-nha-mat-tien-pho/chu-ngop-can-ban-can-nha-tam-huyet-gap-gia-1ty200-id22557823,2024-05-23
"Cho thuê nhà 3 lầu ST mặt tiền Đường Số, Phường Tân Quy, Quận 7","Quận 7, TPHCM",25 triệu,3 PN,3 WC,40 m2,https://mogi.vn/quan-7/mua-nha-mat-tien-pho/cho-thue-nha-3-lau-st-mat-tien-duong-so-phuong-tan-quy-quan-7-id22564469,2024-05-23
"Cho thuê nhà 3 lầu ST mặt tiền Đường Số, Phường Tân Quy, Quận 7","Quận 7, TPHCM",25 triệu,3 PN,3 WC,40 m2,https://mogi.vn/quan-7/mua-nha-mat-tien-pho/cho-thue-nha-3-lau-st-mat-tien-duong-so-phuong-tan-quy-quan-7-id22564469,2024-05-23
CẦN TIỀN Bán Gấp  Nhà  4.2 X19M 2 Lầu Hẻm Xe Hơi HUỲNH TẤN PHÁT.Q7,"Quận 7, TPHCM",6 tỷ 500 triệu,3 PN,3 WC,120 m2,https://mogi.vn/quan-7/mua-nha-hem-ngo/can-tien-ban-gap-nha-4-2-x19m-2-lau-hem-xe-hoi-huynh-tan-phat-q7-id22564465,2024-05-23
"Bán nhà Tân Kỳ Tân Quý Tân Phú 2Tầng 33M2 sổ đẹp Hẻm 3M chỉ 2,95 Tỷ TL","Quận Tân Phú, TPHCM",2 tỷ 950 triệu,4 PN,5 WC,72 m2,https://mogi.vn/quan-tan-phu/mua-nha-hem-ngo/ban-nha-tan-ky-tan-quy-tan-phu-2tang-33m2-so-dep-hem-3m-chi-2-95-ty-tl-id22564460,2024-05-23
"Bán nhà Lũy Bán Bích 2Tầng Mới 51m2 Hẻm 4M chỉ 4,5 Tỷ TL","Quận Tân Phú, TPHCM",4 tỷ 300 triệu,6 PN,6 WC,246 m2,https://mogi.vn/quan-tan-phu/mua-nha-hem-ngo/ban-nha-luy-ban-bich-2tang-moi-51m2-hem-4m-chi-4-5-ty-tl-id22564463,2024-05-23
"Bán nhanh căn ngay đường Vũ Tùng,P.2,Q. Bình Thạnh,62m2/2tỷ1,Sổ riêng","Quận Bình Thạnh, TPHCM",2 tỷ 100 triệu,4 PN,5 WC,76 m2,https://mogi.vn/quan-binh-thanh/mua-nha-mat-tien-pho/ban-nhanh-can-ngay-duong-vu-tung-p-2-q-binh-thanh-62m2-2ty1-so-rieng-id22562090,2024-05-23
"Nhà 1 lầu mặt tiền hẻm 3m Đường Số 25A, Phường Tân Quy, Quận 7","Quận 7, TPHCM",3 tỷ 800 triệu,6 PN,5 WC,50 m2,https://mogi.vn/quan-7/mua-nha-hem-ngo/nha-1-lau-mat-tien-hem-3m-duong-so-25a-phuong-tan-quy-quan-7-id22564424,2024-05-23
"Không nhanh là mất ! Bán nhà Nguyễn Suý, Tân Phú,3 tầng,67m2,2ty450tr","Quận Tân Phú, TPHCM",2 tỷ 450 triệu,3 PN,2 WC,169 m2,https://mogi.vn/quan-tan-phu/mua-nha-mat-tien-pho/khong-nhanh-la-mat-ban-nha-nguyen-suy-tan-phu-3-tang-67m2-2ty450tr-id22564207,2024-05-23
"Bán gấp nhà Nguyên Hồng,P.11,Q.Bình Thạnh.67m2/2 tỷ 360,SHR,thuê 19tr","Quận Bình Thạnh, TPHCM",2 tỷ 360 triệu,4 PN,5 WC,80 m2,https://mogi.vn/quan-binh-thanh/mua-nha-mat-tien-pho/ban-gap-nha-nguyen-hong-p-11-q-binh-thanh-67m2-2-ty-360-shr-thue-19tr-id22564415,2024-05-23
Căn Hộ DV 21 Phòng Nơ Trang Long Bình Thạnh,"Quận Bình Thạnh, TPHCM",15 tỷ,5 PN,5 WC,50 m2,https://mogi.vn/quan-binh-thanh/mua-nha-hem-ngo/can-ho-dv-21-phong-no-trang-long-binh-thanh-id22563968,2024-05-23
"Bán nhà Hẻm Xe Hơi thông CMT8,Quận 3","Quận 3, TPHCM",8 tỷ 500 triệu,3 PN,3 WC,60 m2,https://mogi.vn/quan-3/mua-nha-hem-ngo/ban-nha-hem-xe-hoi-thong-cmt8-quan-3-id22563980,2024-05-23
"Bán nhà Hẻm Xe Hơi thông 3/2,Quận 10","Quận 10, TPHCM",9 tỷ 500 triệu,3 PN,3 WC,40 m2,https://mogi.vn/quan-10/mua-nha-hem-ngo/ban-nha-hem-xe-hoi-thong-3-2-quan-10-id22563982,2024-05-23
"Bán nhà hẻm 3 gác thông Sư Vạn Hạnh,Quận 10","Quận 10, TPHCM",3 tỷ,4 PN,3 WC,60 m2,https://mogi.vn/quan-10/mua-nha-hem-ngo/ban-nha-hem-3-gac-thong-su-van-hanh-quan-10-id22563984,2024-05-23
Kẹt bán nhanh nhà MTKD 7 lầu thang máy Phạm Văn Đồng p13 Bình Thạnh,"Quận Bình Thạnh, TPHCM",8 tỷ 980 triệu,3 PN,3 WC,288 m2,https://mogi.vn/quan-binh-thanh/mua-nha-mat-tien-pho/ket-ban-nhanh-nha-mtkd-7-lau-thang-may-pham-van-dong-p13-binh-thanh-id22564323,2024-05-23
"BánNhà 1tx2l,ngay vạn phúc riverside,thủ đức,dtsd 216m2,giá 7,43 tỷ,TL","Quận Thủ Đức (TP. Thủ Đức), TPHCM",7 tỷ 430 triệu,8 PN,5 WC,127 m2,https://mogi.vn/quan-thu-duc/mua-nha-mat-tien-pho/bannha-1tx2l-ngay-van-phuc-riverside-thu-duc-dtsd-216m2-gia-7-43-ty-tl-id22563948,2024-05-23
GIÁ TỐT !! Nhà 4 tầng MTKD đông đúc Đường số 29 - 4x20m GẦN MT TÊN LỬA,"Quận Bình Tân, TPHCM",10 tỷ 500 triệu,3 PN,2 WC,133 m2,https://mogi.vn/quan-binh-tan/mua-nha-mat-tien-pho/gia-tot-nha-4-tang-mtkd-dong-duc-duong-so-29-4x20m-gan-mt-ten-lua-id22563939,2024-05-23
"Hạ giá bán nhanh nhà mt đường số Tân quy 7x16m- 3Tầng, giá 13,8 tỷ","Quận 7, TPHCM",13 tỷ 800 triệu,4 PN,4 WC,42 m2,https://mogi.vn/quan-7/mua-nha-mat-tien-pho/ha-gia-ban-nhanh-nha-mt-duong-so-tan-quy-7x16m-3tang-gia-13-8-ty-id22564333,2024-05-23
Hạ giá bánh nhanh biệt thự bộ Công An Nguyễn Văn Qùy Quận 7,"Quận 7, TPHCM",13 tỷ,3 PN,3 WC,70 m2,https://mogi.vn/quan-7/mua-nha-biet-thu-lien-ke/ha-gia-banh-nhanh-biet-thu-bo-cong-an-nguyen-van-quy-quan-7-id22564328,2024-05-23
Hạ giá bánh nhanh biệt thự bộ Công An Nguyễn Văn Qùy Quận 7,"Quận 7, TPHCM",13 tỷ,3 PN,3 WC,70 m2,https://mogi.vn/quan-7/mua-nha-biet-thu-lien-ke/ha-gia-banh-nhanh-biet-thu-bo-cong-an-nguyen-van-quy-quan-7-id22564328,2024-05-23
"Bán nhà mặt tiền đường số khu Tân Mỹ Liền kề phú mỹ hưng q7, Nhà 4tẦNG","Quận 7, TPHCM",8 tỷ,2 PN,2 WC,35 m2,https://mogi.vn/quan-7/mua-nha-mat-tien-pho/ban-nha-mat-tien-duong-so-khu-tan-my-lien-ke-phu-my-hung-q7-nha-4tang-id22564326,2024-05-23
"Bán nhà mt hẻm 502 Huỳnh Tấn Phát- Kinh doanh đa ngành, ngang 4x15m","Quận 7, TPHCM",7 tỷ,3 PN,4 WC,35 m2,https://mogi.vn/quan-7/mua-nha-mat-tien-pho/ban-nha-mt-hem-502-huynh-tan-phat-kinh-doanh-da-nganh-ngang-4x15m-id22564324,2024-05-23
"Bán nhà dẹp Bùi Văn Ba Quận 7, Ngang 7,5x13m- nhà 3 tầng mới","Quận 7, TPHCM",7 tỷ 490 triệu,8 PN,8 WC,340 m2,https://mogi.vn/quan-7/mua-nha-hem-ngo/ban-nha-dep-bui-van-ba-quan-7-ngang-7-5x13m-nha-3-tang-moi-id22564308,2024-05-23
Bán nhà mặt tiền đường số tân kiểng Quận 7,"Quận 7, TPHCM",7 tỷ 600 triệu,3 PN,2 WC,133 m2,https://mogi.vn/quan-7/mua-nha-mat-tien-pho/ban-nha-mat-tien-duong-so-tan-kieng-quan-7-id22564311,2024-05-23
Bán nhà co tthu nhập cao Trần xuân soạn gần lotte mart Quận 7,"Quận 7, TPHCM",7 tỷ 300 triệu,5 PN,5 WC,110 m2,https://mogi.vn/quan-7/mua-nha-hem-ngo/ban-nha-co-tthu-nhap-cao-tran-xuan-soan-gan-lotte-mart-quan-7-id22564314,2024-05-23
Bán nhà khu Nam Long Trần Trọng Cung Q7 - 67m² - 3 tầng mới đẹp ở ngay,"Quận 7, TPHCM",8 tỷ 500 triệu,8 PN,8 WC,316 m2,https://mogi.vn/quan-7/mua-nha-hem-ngo/ban-nha-khu-nam-long-tran-trong-cung-q7-67m-3-tang-moi-dep-o-ngay-id22564317,2024-05-23
bán nhà đẹp lung linh xe hơi vô tới nhà 502 Huỳnh Tấn Phát Quận 7,"Quận 7, TPHCM",7 tỷ 900 triệu,7 PN,7 WC,400 m2,https://mogi.vn/quan-7/mua-nha-hem-ngo/ban-nha-dep-lung-linh-xe-hoi-vo-toi-nha-502-huynh-tan-phat-quan-7-id22564321,2024-05-23
"Hẻm xe tải thông 123m2(7.5x17m) 300m2xd 5PN Đồng Đen, Tân Bình","Quận Tân Bình, TPHCM",19 tỷ,2 PN,2 WC,78 m2,https://mogi.vn/quan-tan-binh/mua-nha-biet-thu-lien-ke/hem-xe-tai-thong-123m2-7-5x17m-300m2xd-5pn-dong-den-tan-binh-id22564293,2024-05-23
"XE HƠI VÀO NHÀ NGAY NGÃ TƯ PHÚ NHUẬN, nhà mới ở ngay, 50m2, 7.x tỷ TL","Quận Phú Nhuận, TPHCM",7 tỷ,5 PN,5 WC,123 m2,https://mogi.vn/quan-phu-nhuan/mua-nha-hem-ngo/xe-hoi-vao-nha-ngay-nga-tu-phu-nhuan-nha-moi-o-ngay-50m2-7-x-ty-tl-id22563931,2024-05-23
"Hẻm xe tải 142m2 11 phòng cho thuê TN 25 triệu Trần Văn Quang, TânBinh","Quận Tân Bình, TPHCM",13 tỷ 500 triệu,1 PN,1 WC,30 m2,https://mogi.vn/quan-tan-binh/mua-nha-hem-ngo/hem-xe-tai-142m2-11-phong-cho-thue-tn-25-trieu-tran-van-quang-tanbinh-id22564298,2024-05-23
Bán nhà mặt tiền đường gần cHỢ Tân Quy kinh doanh buôn bán đa nganh,"Quận 7, TPHCM",11 tỷ 500 triệu,3 PN,2 WC,133 m2,https://mogi.vn/quan-7/mua-nha-mat-tien-pho/ban-nha-mat-tien-duong-gan-cho-tan-quy-kinh-doanh-buon-ban-da-nganh-id22564258,2024-05-23
"Bán nhà đường rộng 20m P.tÂN Kiểng Quận 7, Ngang 4,2x19m","Quận 7, TPHCM",11 tỷ 500 triệu,4 PN,5 WC,276 m2,https://mogi.vn/quan-7/mua-nha-mat-tien-pho/ban-nha-duong-rong-20m-p-tan-kieng-quan-7-ngang-4-2x19m-id22564252,2024-05-23
"Bán nhà góc 2 mt đường số Lý Phục man q7, Ngang 5,5x21m- Giá rẻ 9,9tỷ","Quận 7, TPHCM",9 tỷ 900 triệu,5 PN,5 WC,276 m2,https://mogi.vn/quan-7/mua-nha-mat-tien-pho/ban-nha-goc-2-mt-duong-so-ly-phuc-man-q7-ngang-5-5x21m-gia-re-9-9ty-id22564246,2024-05-23
"HIẾM! Bán Nhà Đẹp 4 Tầng HXH Nam Kỳ Khởi Nghĩa, 35m2, Ngang 4m, 7.2 Tỷ","Quận 3, TPHCM",7 tỷ 200 triệu,5 PN,5 WC,60 m2,https://mogi.vn/quan-3/mua-nha-hem-ngo/hiem-ban-nha-dep-4-tang-hxh-nam-ky-khoi-nghia-35m2-ngang-4m-7-2-ty-id22563914,2024-05-23
"XUẤT NGOẠI Bán Nhà Đẹp 4 Tầng HXH Hoàng Sa, 41m2, Ngang 4m, 7 Tỷ TL","Quận 3, TPHCM",7 tỷ,3 PN,2 WC,133 m2,https://mogi.vn/quan-3/mua-nha-hem-ngo/xuat-ngoai-ban-nha-dep-4-tang-hxh-hoang-sa-41m2-ngang-4m-7-ty-tl-id22563930,2024-05-23
Bán Nhà Mặt Tiền Ngay Điện Biên Phủ p17 Bình Thạnh DT 12x25m,"Quận Bình Thạnh, TPHCM",65 tỷ,4 PN,4 WC,126 m2,https://mogi.vn/quan-binh-thanh/mua-nha-mat-tien-pho/ba-n-nha-ma-t-tie-n-ngay-die-n-bien-phu-p17-bi-nh-tha-nh-dt-12x25m-id22564214,2024-05-23
"Bán nhà HXH đường Nguyễn Tư Giản, phường 12, gò vấp (4x16) Giá: 6,5 tỷ","Quận Gò Vấp, TPHCM",6 tỷ 500 triệu,2 PN,2 WC,37 m2,https://mogi.vn/quan-go-vap/mua-nha-hem-ngo/ban-nha-hxh-duong-nguyen-tu-gian-phuong-12-go-vap-4x16-gia-6-5-ty-id22555773,2024-05-23
"Bán nhà góc 2MT Đường số Lý Phục man Quận 7, ngang 6x10m-Nhà 3Tầng","Quận 7, TPHCM",9 tỷ 300 triệu,4 PN,5 WC,64 m2,https://mogi.vn/quan-7/mua-nha-mat-tien-pho/ban-nha-goc-2mt-duong-so-ly-phuc-man-quan-7-ngang-6x10m-nha-3tang-id22564238,2024-05-23
"Bán nhà HXH đường số 1, phường 16, gò vấp. (4,5x12) Giá: 7,8 Tỷ","Quận Gò Vấp, TPHCM",7 tỷ 800 triệu,2 PN,2 WC,38 m2,https://mogi.vn/quan-go-vap/mua-nha-hem-ngo/ban-nha-hxh-duong-so-1-phuong-16-go-vap-4-5x12-gia-7-8-ty-id22555780,2024-05-23
"Bán nhà HXH đường Nguyễn Thái Sơn, phường 3, Gò vấp. (4x12) Giá: 8,9tỷ","Quận Gò Vấp, TPHCM",8 tỷ 900 triệu,6 PN,6 WC,280 m2,https://mogi.vn/quan-go-vap/mua-nha-hem-ngo/ban-nha-hxh-duong-nguyen-thai-son-phuong-3-go-vap-4x12-gia-8-9ty-id22555794,2024-05-23
"Bán nhà HXH Nguyễn Thái Sơn, phường 3, gò vấp.(4x12) giá: 8,9 tỷ","Quận Gò Vấp, TPHCM",8 tỷ 900 triệu,3 PN,2 WC,133 m2,https://mogi.vn/quan-go-vap/mua-nha-hem-ngo/ban-nha-hxh-nguyen-thai-son-phuong-3-go-vap-4x12-gia-8-9-ty-id22555804,2024-05-23
"Bán nhà hẻm 3m Hậu Giang, 26,3m2, 2 lầu sân thượng, chỉ 2.5 tỷ!","Quận 6, TPHCM",2 tỷ 500 triệu,5 PN,4 WC,196 m2,https://mogi.vn/quan-6/mua-nha-hem-ngo/ban-nha-hem-3m-hau-giang-26-3m2-2-lau-san-thuong-chi-2-5-ty-id22564213,2024-05-23
"Bán nhà mới HXH Hậu Giang, 3.2 x 10m, 1 lầu, 2 phòng ngủ!","Quận 6, TPHCM",4 tỷ 500 triệu,6 PN,6 WC,90 m2,https://mogi.vn/quan-6/mua-nha-hem-ngo/ban-nha-moi-hxh-hau-giang-3-2-x-10m-1-lau-2-phong-ngu-id22564231,2024-05-23
"Bán nhà HXH đường Nguyễn Văn Công, phường 3, gò vấp.(4x10) Giá:6,899tỷ","Quận Gò Vấp, TPHCM",6 tỷ 899 triệu,9 PN,6 WC,112 m2,https://mogi.vn/quan-go-vap/mua-nha-hem-ngo/ban-nha-hxh-duong-nguyen-van-cong-phuong-3-go-vap-4x10-gia-6-899ty-id22556756,2024-05-23
"bán nhà HXH đường Trần Bá Giao, phường 5, gò vấp","Quận Gò Vấp, TPHCM",7 tỷ 290 triệu,4 PN,4 WC,2323 m2,https://mogi.vn/quan-go-vap/mua-nha-hem-ngo/ban-nha-hxh-duong-tran-ba-giao-phuong-5-go-vap-id22556758,2024-05-23
"Bán nhà HXH đường số 20, phường 5, gò vấp.(4x16) Giá: 9,19 Tỷ","Quận Gò Vấp, TPHCM",9 tỷ 190 triệu,6 PN,6 WC,40 m2,https://mogi.vn/quan-go-vap/mua-nha-hem-ngo/ban-nha-hxh-duong-so-20-phuong-5-go-vap-4x16-gia-9-19-ty-id22556759,2024-05-23
"Bán biệt thự hẻm XE HƠI 101 Nguyễn Chí Thanh, Phường 9 Quận 5 - 168m2","Quận 5, TPHCM",30 tỷ,34 PN,34 WC,264 m2,https://mogi.vn/quan-5/mua-nha-biet-thu-lien-ke/ban-biet-thu-hem-xe-hoi-101-nguyen-chi-thanh-phuong-9-quan-5-168m2-id22515675,2024-05-23
"Bán nhà HXH đường Lê Lai, phường 3, gò vấp.(4x13) Giá: 8,89 tỷ","Quận Gò Vấp, TPHCM",8 tỷ 890 triệu,4 PN,5 WC,62 m2,https://mogi.vn/quan-go-vap/mua-nha-hem-ngo/ban-nha-hxh-duong-le-lai-phuong-3-go-vap-4x13-gia-8-89-ty-id22556760,2024-05-23
"Bán biệt thự hẻm Cách Mạng Tháng 8, Phường 11 Quận 3 - 173m2","Quận 3, TPHCM",23 tỷ 500 triệu,3 PN,3 WC,86 m2,https://mogi.vn/quan-3/mua-nha-biet-thu-lien-ke/ban-biet-thu-hem-cach-mang-thang-8-phuong-11-quan-3-173m2-id22515552,2024-05-23
NGỘP Hẻm 76 Đường Số 37 Phường Tân Kiểng - Quận 7. 56m2,"Quận 7, TPHCM",4 tỷ,3 PN,3 WC,84 m2,https://mogi.vn/quan-7/mua-nha-hem-ngo/ngop-hem-76-duong-so-37-phuong-tan-kieng-quan-7-56m2-id22508679,2024-05-23
"Bán nhà HXH 458 Quang Trung, phường 10, gò vấp 132,4m2 giá: 11 tỷ","Quận Gò Vấp, TPHCM",11 tỷ,3 PN,4 WC,33 m2,https://mogi.vn/quan-go-vap/mua-nha-hem-ngo/ban-nha-hxh-458-quang-trung-phuong-10-go-vap-132-4m2-gia-11-ty-id22560378,2024-05-23
"Bán nhà khu đồng bộ HXH Nguyễn Văn Dung,phường 6,gò vấp 50m2 Giá:7,2tỷ","Quận Gò Vấp, TPHCM",7 tỷ 200 triệu,8 PN,10 WC,200 m2,https://mogi.vn/quan-go-vap/mua-nha-hem-ngo/ban-nha-khu-dong-bo-hxh-nguyen-van-dung-phuong-6-go-vap-50m2-gia-7-2ty-id22561120,2024-05-23
"Bán nhà HXH 33 đường số 5, phường 17, gò vấp (5x15) Giá: 6,8 tỷ","Quận Gò Vấp, TPHCM",6 tỷ 800 triệu,12 PN,24 WC,160 m2,https://mogi.vn/quan-go-vap/mua-nha-hem-ngo/ban-nha-hxh-33-duong-so-5-phuong-17-go-vap-5x15-gia-6-8-ty-id22563773,2024-05-23
"Bán nhà HXH 1179 Phan Văn Trị, phường 10, gò vấp(4x18) Giá: 7,7 tỷ","Quận Gò Vấp, TPHCM",7 tỷ 700 triệu,6 PN,5 WC,278 m2,https://mogi.vn/quan-go-vap/mua-nha-hem-ngo/ban-nha-hxh-1179-phan-van-tri-phuong-10-go-vap-4x18-gia-7-7-ty-id22563786,2024-05-23
"Bán nhà HXH đường Nguyễn Văn Công, phường 3, gò vấp (4x13) Giá: 7,2 Tỷ","Quận Gò Vấp, TPHCM",7 tỷ 200 triệu,5 PN,5 WC,80 m2,https://mogi.vn/quan-go-vap/mua-nha-hem-ngo/ban-nha-hxh-duong-nguyen-van-cong-phuong-3-go-vap-4x13-gia-7-2-ty-id22563801,2024-05-23
"Bán nhà HXH đường Nguyễn Văn Nghi, phường 7, gò vấp(5,3x7,7)Giá: 8,1tỷ","Quận Gò Vấp, TPHCM",8 tỷ 100 triệu,23 PN,23 WC,132 m2,https://mogi.vn/quan-go-vap/mua-nha-hem-ngo/ban-nha-hxh-duong-nguyen-van-nghi-phuong-7-go-vap-5-3x7-7-gia-8-1ty-id22563817,2024-05-23
Dòng tiền 65 triệu - Mặt Tiền đường 7A Tên Lửa 100m² 9 Phòng Dịch Vụ,"Quận Bình Tân, TPHCM",13 tỷ 500 triệu,20 PN,12 WC,160 m2,https://mogi.vn/quan-binh-tan/mua-nha-mat-tien-pho/dong-tien-65-trieu-mat-tien-duong-7a-ten-lua-100m-9-phong-dich-vu-id22564016,2024-05-23
MTKD đường 688 Tân Kỳ Tân Quý 100m²( 4 x 25 ) 4 Tầng 5PN mới ở ngay,"Quận Bình Tân, TPHCM",9 tỷ 500 triệu,4 PN,4 WC,80 m2,https://mogi.vn/quan-binh-tan/mua-nha-mat-tien-pho/mtkd-duong-688-tan-ky-tan-quy-100m-4-x-25-4-tang-5pn-moi-o-ngay-id22564021,2024-05-23
"Bán nhà mặt tiền gần Hai Bà Trưng, Quận 1, 10x24m, 4 lầu, 125 tỷ","Quận 1, TPHCM",125 tỷ,3 PN,3 WC,94 m2,https://mogi.vn/quan-1/mua-nha-mat-tien-pho/ban-nha-mat-tien-gan-hai-ba-trung-quan-1-10x24m-4-lau-125-ty-id22564105,2024-05-23
"Bán nhà đường Hai Bà Trưng, 2Võ Thị Sáu, Quận 3, 1x20m, 5 lầu, 65 tỷ","Quận 3, TPHCM",650 tỷ,4 PN,5 WC,140 m2,https://mogi.vn/quan-3/mua-nha-mat-tien-pho/ban-nha-duong-hai-ba-trung-2vo-thi-sau-quan-3-1x20m-5-lau-65-ty-id22564098,2024-05-23
"Góc 2 MT đường Hai Bà Trưng Q1, DT:15x16m - HĐT 250tr/th CTXD 2 hầm 10","Quận 3, TPHCM",70 tỷ,10 PN,10 WC,65 m2,https://mogi.vn/quan-3/mua-nha-mat-tien-pho/goc-2-mt-duong-hai-ba-trung-q1-dt-15x16m-hdt-250tr-th-ctxd-2-ham-10-id22564100,2024-05-23
"Góc 2 MT đường Hai Bà Trưng Q1, DT:15x16m - HĐT 250tr/th CTXD 2 hầm 10","Quận 3, TPHCM",70 tỷ,10 PN,10 WC,65 m2,https://mogi.vn/quan-3/mua-nha-mat-tien-pho/goc-2-mt-duong-hai-ba-trung-q1-dt-15x16m-hdt-250tr-th-ctxd-2-ham-10-id22564100,2024-05-23
"Bán nhà mặt tiền  Võ Thị Sáu, Quận 1, 10x24m, 3 lầu, 129 tỷ","Quận 1, TPHCM",129 tỷ,4 PN,4 WC,120 m2,https://mogi.vn/quan-1/mua-nha-mat-tien-pho/ban-nha-mat-tien-vo-thi-sau-quan-1-10x24m-3-lau-129-ty-id22564108,2024-05-23
